상세검색_서비스분야,상세검색_지원형태,상세검색_신청방법,게시글_id,게시글_url,제목,요약,지역상위,지역하위,지원형태,신청기간,접수기관,전화문의,지원대상,선정기준,지원내용,신청방법,제출서류,문의처,최종수정일,스크랩시간
보육-교육,현금,방문신청,B49000100018,https://www.gov.kr/portal/rcvfvrSvc/dtlEx/B49000100018?administOrgCd=ALL,산재근로자 및 자녀 장학사업,"산재근로자와 그 자녀에게 고등학교 입학금, 수업료, 학교운영지원비를 지원하여 산재근로자의 실질소득을 증대시키고 생활 안정에 기여함으로써 교육 기회 제공 및 복지증진 도모",중앙부처,,현금,기타:매년초 대상자 선발 후 잔여 예산의 범위에서 수시 모집합니다.,"근로복지공단 7개(서울, 부산, 경인, 대구, 광주, 대전, 강원) 지역본부 및 서울남부, 수원, 창원, 전주지사",근로복지공단 (☎ 1588-0075),"○ 산업재해보상보험법에 따라 산업재해로 인정받은 근로자 중 다음 어느 하나에 해당되고 초ㆍ중등교육법 제2조의 규정에 의한 학교 과정에 입학 예정 또는 재학 중인 고등학생 - 사망근로자의 배우자 및 자녀 - 상병보상연금 수급자 본인, 배우자 및 자녀  - 장해등급 1-7급 판정자 본인, 배우자 및 자녀 - 5년 이상 장기 요양자 중 이황화탄소(CS2) 질병 판정자 본인, 배우자 및 자녀","○ 초ㆍ중등교육법 제2조의 규정에 의한 학교에 입학 예정 또는 재학 중인 자  - 정규 고등학교, 고등공민학교, 고등기술학교, 특수학교로서 법령에 따라 고등학교로 학력 인정을 받은 학교 ○ 평생교육법 제31조 제2항의 규정에 따라 평생교육시설 중 고등학교 졸업학력을 인정받은 시설에 입학 예정 또는 재학 중인 자","○ 고등학교 입학금, 수업료, 학교운영지원비 합계 연간 총액 5백만 원을 최고 한도액으로 1년간 실 납부금액 지원(연간 최고한도액을 초과하는 경우 초과 금액은 산재근로자 부담)","○ 근로복지공단 해당 지사에 방문, 우편, fax 신청","○ 장학생 선발 신청서 1부, 주민등록 등본 1통, 가족관계 증명서 1부(단, 유족인 경우 2008년 이전 사망 유족은 제적등본)",근로복지공단 (☎  1588-0075),2022-06-13,202210061351
보육-교육,현금,방문신청,340000000106,https://www.gov.kr/portal/rcvfvrSvc/dtlEx/340000000106?administOrgCd=ALL,기장군 장학금 지원,,부산광역시,기장군,현금,"상반기(5월), 하반기(10월)",주민센터,인재양성과 (☎ 051-709-4334),"○ 공고일 기준, 부모 또는 학생 본인이 주민등록상 연속하여 1년 이상 기장군에 계속 거주하고 있는 자로서, 각 장학금종류의 신청자격을 충족하는 자",,"○ 기장군 성적우수,복지,다자녀, 특기장학금 지원 - 대학생(성적우수,복지,다자녀,특기장학금) : 학기 등록금 실제 납부금액(최대 200만원) - 초·중·고등학생 (특기장학금): 1인당 50만원",○ 방문 신청 - 주민센터 : 거주지 관할 행정복지센터에 방문 신청서 방문 제출,,인재양성과 (☎  051-709-4334),2022-01-05,202210061351
보육-교육,현금,방문신청,628000000162,https://www.gov.kr/portal/rcvfvrSvc/dtlEx/628000000162?administOrgCd=ALL,저소득 한부모가족 지원,,인천광역시,,현금,상시신청,주민센터                                                                                                                                                                                                                                                                        시·군·구청,가족다문화과 (☎ 032-440-2872),○ 중위소득 52% 이하 한부모가족 자녀,,"○ 저소득 한부모가정 자녀 교육비 지원 : 부교재비, 교통비 ○ 저소득 한부모가정 고교생 입학금 및 수업료 지원 : 무상교육 제외 사립고○ 저소득 한부모가정 동절기 생활안정지원 : 가구당 8만원 (매년 11월 지급)",○ 방문 신청  - 주민센터 : 관할 동주민센터 - 시군구 : 시군구청,,가족다문화과 (☎  032-440-2872),2022-07-18,202210061351
보육-교육,현금,기타,172100000007,https://www.gov.kr/portal/rcvfvrSvc/dtlEx/172100000007?administOrgCd=ALL,저소득층 초중고등학생 온라인학습 데이터 무료 지원,저소득층 초중고교생 대상으로 EBS 등 교육콘텐츠 이용시 모바일 데이터요금 지원,중앙부처,,현금,상시신청,통신사 고객센터,통신사 고객센터 (☎ [모바일] 휴대폰+114(무료)),○ 국민기초생활 수급대상자 및 차상위계층 초중고교생,지원대상과 동일,"○ 저소득층 초중고교생이 EBS, 디지털교과서, e 학습터, 사이언스 올 등 교육콘텐츠를 이용할 때 소진되는 모바일 데이터요금 무료 지원","○ 지원을 희망하는 학생, 보호자는 가입하고 있는 통신 3사의 고객센터(☎114)를 통하여 별도 서류 제출 없이 간편하게 신청 - 통신 3사 부가서비스(무료) : EBS 데이터 팩(SKT), EBS 데이터 안심옵션(KT, LGU+) 신청",,통신사 고객센터 (☎  [모바일] 휴대폰+114(무료)),2022-03-29,202210061351
보육-교육,현금,기타,641000000129,https://www.gov.kr/portal/rcvfvrSvc/dtlEx/641000000129?administOrgCd=ALL,"경기도민 중고 신입생 교복비 지원(대안교육기관, 타시도)",,경기도,,현금,2022.04.01.~2022.08.31. (기간 외 전학생 등은 시군청 문의),경기민원24(gg24.gg.go.kr)                                                                                                                                                                                                                                                                                                                        시·군·구청,교육협력과 (☎ 031-8008-4815),"입(전)학일 기준 경기도민이면서, 도 내외 중,고교 1학년과정 대안교육기관 및 타 시도 소재 학교 1학년 입(전)학생 (경기도 내 중고등학교 입학생은 학교에서 현물(교복)으로 지급됨에 위 지원사업 대상아님)",,"교복(단체복)을 입는 대안교육기관 중고등학교 1학년 과정 및 타시도 중고등학교 1학년 입학 시, 1인당 30만원 이내 구입 실비 지원 (경기도 내 중고등학교 입학생은 학교에서 현물(교복)으로 지급됨에 위 지원사업 대상아님)",(2022년도) 경기민원24(gg24.gg.go.kr) 온라인 신청    *  부득이할 경우 시군 문의 후 방문신청<문  의  처>수원시 교육청소년과 031-228-2388용인시 교육청소년과 031-324-2489고양시 평생교육과 031-8075-2273성남시 교육청소년과 031-729-3042화성시 교육청소년과 031-5189-3452부천시 평생교육과 032-625-4072남양주시 미래인재과 031-590-2107안산시 교육청소년과 031-481-3453평택시 교육청소년과 031-8024-2723안양시 교육청소년과 031-8045-2265시흥시 교육자치과 031-310-3492김포시 교육청소년과 031-980-2580파주시 교육지원과 031-940-5251의정부시 교육청소년과 031-828-2424광주시 교육청소년과 031-760-4433광명시 교육청소년과 02-2680-2169하남시 평생교육과 031-790-5500군포시 청소년청년정책과 031-390-0581오산시 평생교육과 031-8036-7533양주시 평생교육진흥원 031-8082-7383이천시 교육청소년과 031-644-4337구리시 평생학습과 031-550-2714안성시 교육청소년과 031-678-6834의왕시 평생교육과 031-345-2273포천시 교육지원과 031-538-2033양평군 복지정책과 031-770-3793여주시 평생교육과 031-887-2583동두천시 평생교육원 031-860-3318과천시 교육청소년과 02-2150-3912가평군 평생교육사업소 031-580-2466연천군 통일평생교육원 031-839-4437,"재학증명서, 교육과정 관련 확인서류(대안교육기관 입학생만 해당)교복 착용 규정, 교복구입 영수증, 통장사본",교육협력과 (☎  031-8008-4815),2022-07-18,202210061351
보육-교육,현금,기타,497000000109,https://www.gov.kr/portal/rcvfvrSvc/dtlEx/497000000109?administOrgCd=ALL,영광군 인재육성 장학금,,전라남도,영광군,현금,접수기관 별 상이,주민센터,총무과 (☎ 061-350-4704),○ 초중고등학생  - 본인 또는 부모의 주소가 계속해서 2년 이상 영광군에 있는 자 중 관내 소재 학교에 다니는 학생 ○ 대학생 - 본인 또는 부모의 주소가 계속해서 2년 이상 영광군에 있는 자 중  ○ 교사  - 본인의 주소가 계속해서 1년 이상 영광군에 있고 관내 소재 초중고등학교에 재직중인 자,,○ 초·중·고·대학생 장학금,○ 방문 신청  - 주민센터 : 대학생은 읍면사무소 방문접수 ○ 개인 신청절차 없음  - 초·중·고등학생 및 교사는 학교장 추천,,총무과 (☎  061-350-4704),2022-07-18,202210061351
보육-교육,현금,기타,536000000119,https://www.gov.kr/portal/rcvfvrSvc/dtlEx/536000000119?administOrgCd=ALL,저소득 취약계층 지원,,경상남도,밀양시,현금,상시신청,주민센터                                                                                                                                                                                                                                                                        시·군·구청,주민생활지원과 (☎ 055-359-5683),"○ 저소득층 학습환경개선사업 : 기초수급자 및 차상위계층 중 취학자녀를 둔 가구 ○ 취약계층 앰뷸런스 비용 지급 : 기초수급자 및 차상위계층 ○ 저소득주민 건겅보험료 지원 : 건강보험 부과금액이 10,400원 이하인 65세 이상 노인, 등록 장애인, 한부모 가정 가구, 조손세대 및 소년소녀가장세대",,"○ 저소득층 학습환경개선사업 : 기초수급자 등 저소득계층 자녀 책상등 구매비용(35만원) 지급 ○ 취약계층 앰뷸런스 비용 지급 : 기초수급자 등 관외 응급이송 필요 시 이송비용 지원(30만원 이내) ○ 저소득주민 건겅보험료 지원 : 65세 이상 노인 등 건강보험료 10,400원 이하인 경우 겅강보험료 지원",○ 방문 신청 - 주민센터 : 관할 읍면동 행정복지센터 - 시군구 : 관할 시청 방문 신청 ○ 개인 신청절차 없음 - 저소득주민 건강보험료 지원: 별도 신청 불필요,,주민생활지원과 (☎  055-359-5683),2021-12-13,202210061351
보육-교육,현금,기타,304000000150,https://www.gov.kr/portal/rcvfvrSvc/dtlEx/304000000150?administOrgCd=ALL,인터넷 수능방송 지원,,서울특별시,광진구,현금이용권,상시신청,시·군·구청,광진구 교육지원과 (☎ 02-450-7163),광진구 거주 또는 학교에 재학중인 중·고등학생,,강남구 인터넷 수능방송(강남인강) 가입비 지원 - 취약계층 : 연 가입비 전액 지원 - 일반 : 연 가입비 중 일부 지원 ※ 학생 자부담 : 만원,온라인 신청(광진구청 홈페이지),,광진구 교육지원과 (☎  02-450-7163),2022-08-19,202210061351
보육-교육,현금,기타,629000000144,https://www.gov.kr/portal/rcvfvrSvc/dtlEx/629000000144?administOrgCd=ALL,생활시설아동용돈지급,,광주광역시,,현금,접수기관 별 상이,시·군·구청,동구청 (☎ 062-608-2675)서구청 (☎ 062-360-7646),"○ 아동복지시설(양육시설, 공동생활가정) 입소아동 중 초․중․고등학생",,○ 지원목적 : 생활시설 아동 스스로 필요한 최소한의 용돈지원으로 소비생활을 건전하게 유도하고 절약습관으로 향후 자립정신 고취 ○ 지원내용 : 학용품 등 아동 스스로 필요한 최소한의 용돈 지원,○ 각 아동복지시설의 사회복지시설정보시스템을 통한 온라인신청(개인별 신청 불가),,동구청 (☎  062-608-2675)서구청 (☎  062-360-7646)남구청 (☎  062-607-3551)북구청 (☎  062-410-6419)광산구청 (☎  062-960-8456),2022-02-08,202210061351
보육-교육,현금,기타,374000000143,https://www.gov.kr/portal/rcvfvrSvc/dtlEx/374000000143?administOrgCd=ALL,보육료지원아동보육경비지원,,경기도,수원시,현금,상시신청,시·군·구청,수원시 보육아동과 (☎ 031-228-3214),"법정저소득층, 장애아, 다문화 가정, 다자녀(넷째이상)아동  - 수원시 소재 어린이집 입소 및 재원아동으로 수원시 주민등록 등재자  - 법정 저소득층, 장애아, 다문화 가정 아동 : 사회보장정보시스템에서 자동연계된 대상자",,○ 입학준비금 : 10만원(최대/ 연 1회)○ 현장학습비 : 10만원(최대/ 연 1회) * 어린이집을 이동하여 입소하는 경우에도 지원은 최초 1회에 한함,(어린이집) 보육경비 지원 신청 -> (담당부서) 보육경비 지원 검토 및 교부 -> (어린이집) 보육경비 집행,다자녀 아동 : 넷째 이상 자녀 확인서류(주민등록등본 등),수원시 보육아동과 (☎  031-228-3214),2022-07-13,202210061351
보육-교육,현금,기타,629000000177,https://www.gov.kr/portal/rcvfvrSvc/dtlEx/629000000177?administOrgCd=ALL,가정위탁아동 양육보조 지원,,광주광역시,,현금,ㅇ전입일 15일 이전 신거주지 지급 ㅇ 전입일 16일 이후 구거주지 지급,해당 자치구,광주광역시청 출산보육과 (☎ 062-613-3174),○ 지원대상 : 만18세 미만의 가정위탁보호 아동(연장보호아동 포함),,○ 만 18세 미만의 가정위탁보호 아동 1인당 양육보조금 지원 - 가정위탁아동에 대하여 양육비 및 학용품 등 생활필수품 구입비 지원 - 지원금액 : 아동 1인당 월 31만원 지급,○ 가정위탁보호결정에 따라 전입절차 진행후 양육보조금 지급,위탁가정소재지 전입절차를 진행하여 위탁가정 소재에서 양육보조금 지급,광주광역시청 출산보육과 (☎  062-613-3174),2022-02-08,202210061351
보육-교육,현금,기타,357000000111,https://www.gov.kr/portal/rcvfvrSvc/dtlEx/357000000111?administOrgCd=ALL,중·고교신입생 무상교복 지원,,인천광역시,강화군,현금,상시신청,주민센터,사회복지과 (☎ 032-930-3584),○ 관내 중고등학교 입학 신입생,,○ 인천시 교복구매 비용 이외 차액분 지급,○ 방문 신청 - 주민센터 : 거주지 읍면사무소 신청  ○ 개인 신청절차 없음  - 관내 학교에서 대상자 취합 후 일괄 신청,,사회복지과 (☎  032-930-3584),2021-11-17,202210061351
보육-교육,현금,기타,405000000628,https://www.gov.kr/portal/rcvfvrSvc/dtlEx/405000000628?administOrgCd=ALL,취약계층 입학준비금 지원,,경기도,용인시,현금,상시신청,어린이집,아동보육과 (☎ 031-324-3279),○ 어린이집을 이용하고 있는 장애아 및 법정저소득층 영유아,,○ 필요경비 중 입학준비금 지원(연 1회/10만원 이내/ 아동당),○ 아동의 보호자가 어린이집에 신청,"입학준비금 납부 및 물품 수령 확인서류, 통장사본",아동보육과 (☎  031-324-3279),2022-06-30,202210061351
보육-교육,현금,기타,650000000265,https://www.gov.kr/portal/rcvfvrSvc/dtlEx/650000000265?administOrgCd=ALL,저소득 아동보호 지원,,제주특별자치도,,현금,상시신청,개인 신청절차 없음,제주시 복지위생국 주민복지과 (☎ 064-728-2685),○ 가정위탁보호아동 및 세대,,"○ 가정위탁아동 세대 월동대책비 지원 - 지원내용 : 동절기를 대비하기 위한 월동대책비 지원 - 지원대상 : 가정위탁세대 - 지원기준 : 세대당 15만원 - 지원방법 : 지원대상자 또는 보호자 계좌로 입금 ○ 가정위탁아동 문화활동비 지원 - 지원내용 : 가정위탁아동에 대해 일상생활에 따르는 최소한의 경비 지원을 위한 문화 활동비(용돈) 지급 - 지원대상 : 초·중·고에 재학중인 가정위탁아동 - 지원기준 : 초 2만원, 중 3만원, 고 4만원/월 - 지원방법 : 지원대상자 또는 보호자 계좌로 입금 ○ 가정위탁아동 학습비(재능개발) 지원 - 지원내용 : 가정위탁보호 아동 중·고생 학습비(재능개발) 지원 - 지원대상 : 가정위탁보호 아동 중·고교에 재학중인 아동 - 지원기준 : 1년 12개월, 월 15만원 한도 - 지원방법 : 지원대상자 또는 보호자 계좌로 입금",○ 개인 신청절차 없음 - 가정위탁보호아동으로 선정 시 양육보조금 지원,,제주시 복지위생국 주민복지과 (☎  064-728-2685),2022-01-26,202210061351
보육-교육,현금,기타,497000000115,https://www.gov.kr/portal/rcvfvrSvc/dtlEx/497000000115?administOrgCd=ALL,기초생활수급자 수학여행비 및 체험학습비 지원,,전라남도,영광군,현금,상시신청,개인 신청절차 없음,사회복지과 (☎ 061-350-5348),○ 기초생활보장수급자중 초중고학생,,"○ 기초생활보장수급자 수학여행 및 체험학습비 지원(200,000원)",○ 개인 신청절차 없음  - 학교에서 군청 사회복지과로 신청(기초생활보장수급자 수학여행 및 체험학습비),,사회복지과 (☎  061-350-5348),2021-12-02,202210061351
보육-교육,현물,타사이트신청,641000000111,https://www.gov.kr/portal/rcvfvrSvc/dtlEx/641000000111?administOrgCd=ALL,경기도 어린이 건강과일 공급 지원(구매 지원),,경기도,,현물,2022.8.16. ~ 2022.9.30.,주민센터,친환경농업과 (☎ 031-8008-5455),○ 양육수당을 받고 있으며 신청일 기준 경기도에 주민등록을 둔 보육가정 미취학(86개월 미만) 어린이,,"○ 지원대상 - 신청일 기준 경기도 시군내 거주하면서 어린이집, 유치원 등에 다니지 않고 가정에서 보육되는 미취학 어린이  (8월 또는 9월 가정양육수당 또는 영아수당현금 수급자) ○ 지원내용 - 신청기간 내 '건강과일'을 신청하여 지원대상자로 선정된 가정보육 어린이에게 경기도산 과일을 포함한 국내산 제철과일 꾸러미를 배송 공급(연1회) ○ 신청기간- 2022. 8월 16일(화) 09:00 ~ 2022. 9월 30일(금) 18:00 ○ 지원대상자 선정결과 발표  * 시군마다 발표일자는 달라질 수 있음- 2022. 10월 12일(수) 이후 ○ 과일꾸러미 배송기간- 2022. 11월 ~ 12월 (예정)","○ 온라인 신청- 경기민원24(https://gg24.gg.go.kr) ○ 방문 신청 - 읍면동 행정복지센터 * 온라인 신청이 불가할 경우, 아동의 주민등록상 거주지읍면동 주민센터에 방문 신청","○ 온라인 신청(경기민원24) - 별도 제출서류 없음* 단, 행정정보 공동이용 정보연계 미동의 시 신청자(아동) 주민등록 초본을 첨부 제출해야합니다.  ○ 방문 신청(읍면동 행정복지센터) - 가정보육 어린이 건강과일 신청서 1부 작성 제출- 아동 보호자의 신분 확인을 위해 주민등록증 또는 운전면허증 등 필요",친환경농업과 (☎  031-8008-5455),2022-08-16,202210061351
보육-교육,현물,타사이트신청,374000000128,https://www.gov.kr/portal/rcvfvrSvc/dtlEx/374000000128?administOrgCd=ALL,가정보육어린이 건강과일 공급,,경기도,수원시,현물,2022.08.16~2022.09.30,경기민원24(https://gg24.gg.go.kr) 사이트 접속                                                                                                                                                                                                                                                                                                주민센터,수원시청 생명산업과 (☎ 031-228-3311),"8~9월 중 양육수당 수급 어린이(만 7세 미만), 8~9월 중 영아수당 수급 어린이(만 2세 미만)",,"○ 지원품목 : 도내산 과일 및 과채류○ 지원금액 : 아동 1명당 46,800원○ 지원방법 : 과일꾸러미 택배배송",○ 온라인 신청: 경기민원24(https://gg24.gg.go.kr) 접속 후 본인인증 거쳐 신청 ○ 방문 신청: 주민등록지 관할 동 행정복지센터 방문(신분증 지참),가족관계증명서(전산상으로 확인될 경우 불필요)신청인 신분증,수원시청 생명산업과 (☎  031-228-3311),2022-07-18,202210061351
보육-교육,현물,타사이트신청,629000000191,https://www.gov.kr/portal/rcvfvrSvc/dtlEx/629000000191?administOrgCd=ALL,결식우려 아동 급식 지원,,광주광역시,,현물이용권,상시신청,주민센터,광주광역시 출산보육과 (☎ 062-613-3145),"○ 지원대상 : 만 18세 미만 (미)취학 아동 - 결식우려가 있는 수급자·차상위·한부모 가정 등 저소득층 아동 - 교사, 사회복지사, 통장 등에 의하여 결식 또는 결식우려가 발견되는 아동 - 지역아동센터 등 아동복지프로그램 이용아동 등",,"○ 지원내용 : 저소득층 가정 아동들이 건강하게 자랄 수 있도록 급식을 지원하여 결식예방 및 성장기 아동의 정상적인 신체발달 도모 ○ 지원대상 : 만 18세 미만 (미)취학 아동 - 결식우려가 있는 수급자·차상위·한부모 가정 등 저소득층 아동 - 교사, 사회복지사, 통장 등에 의하여 결식 또는 결식우려가 발견되는 아동 - 지역아동센터 등 아동복지프로그램 이용아동 등 ○ 지원방법 : 아동급식카드 발급, 도시락 배달, 지역아동센터 이용 ○ 지원단가 : 7,000원(1식)",○ 온라인 신청  - 복지로 : http://www.bokjiro.go.kr ○ 방문 신청 - 주민센터 : 거주지 관할 읍면동 주민센터에 방문 신청 ○ 기타 - 우편,,광주광역시 출산보육과 (☎  062-613-3145),2022-02-08,202210061351
보육-교육,현물,타사이트신청,629000000174,https://www.gov.kr/portal/rcvfvrSvc/dtlEx/629000000174?administOrgCd=ALL,토ㆍ공휴일 결식 아동급식,,광주광역시,,현물이용권,상시신청,주민센터,광주광역시 출산보육과 (☎ 062-613-3145),"○ 지원대상 : 만 18세 미만 (미)취학 아동 - 결식우려가 있는 수급자·차상위·한부모 가정 등 저소득층 아동 - 교사, 사회복지사, 통장 등에 의하여 결식 또는 결식우려가 발견되는 아동 - 지역아동센터 등 아동복지프로그램 이용아동 등",,"○ 지원내용 : 저소득층 가정 아동들이 건강하게 자랄 수 있도록 급식을 지원하여 결식예방 및 성장기 아동의 정상적인 신체발달 도모 ○ 지원대상 : 만 18세 미만 (미)취학 아동 - 결식우려가 있는 수급자·차상위·한부모 가정 등 저소득층 아동 - 교사, 사회복지사, 통장 등에 의하여 결식 또는 결식우려가 발견되는 아동 - 지역아동센터 등 아동복지프로그램 이용아동 등 ○ 지원방법 : 아동급식카드 발급, 도시락 배달, 지역아동센터 이용 ○ 지원단가 : 7,000원(1식)",○ 온라인 신청  - 복지로 : http://www.bokjiro.go.kr ○ 방문 신청 - 주민센터 : 거주지 관할 읍면동 주민센터에 방문 신청 ○ 기타 - 우편,,광주광역시 출산보육과 (☎  062-613-3145),2022-02-08,202210061351
보육-교육,현물,타사이트신청,399000000110,https://www.gov.kr/portal/rcvfvrSvc/dtlEx/399000000110?administOrgCd=ALL,학습용 스마트 기기 등 지원서비스,,경기도,남양주시,현물,기간설정(상황에 따라 시기 및 기간 변동될 수 있음),주민센터                                                                                                                                                                                                                                                                        시·군·구청,여성아동과 (☎ 031-590-8402),"○ 남양주시에 주소를 두고 있는 18세미만 아동 - 초등학생 : 기초생활수급자, 법정 저소득 한부모가정 - 중·고등학생 : 기준중위소득100%이하",,"○ 스마트기기, 인터넷 통신비, 인터넷 강의 수강권 지원",○ 온라인 신청 - 남양주시청 : www.nyj.go.kr ○ 방문 신청 - 주민센터 : 주소지 관할 읍면동 주민센터 방문,,여성아동과 (☎  031-590-8402),2022-07-14,202210061351
보육-교육,현물,타사이트신청,348000000369,https://www.gov.kr/portal/rcvfvrSvc/dtlEx/348000000369?administOrgCd=ALL,아기사랑 유모차 대여 서비스,,대구광역시,달성군,현물,상시신청,달성군 장난감도서관,달성군보건소 (☎ 053-668-3133),○ 만3~36개월 영유아가 있는 가정,,○ 만 3~36개월 자녀가 있는 가정에 유모차 1대 기본 6개월 대여(최대 주민등록상 만 36개월까지 연장가능),"○ 방문 신청 - 기타 : 달성군 장난감도서관 방문 신청 - 연회비 : 10,000원  - 이용료 : 6,000원(6개월 기준) ○ 기타 온라인 신청 - https://dstoy.co.kr/toy/",1. 신분증2. 장난감도서관 비회원일 경우 가입서류(장난감도서관 문의),달성군보건소 (☎  053-668-3133),2022-07-11,202210061351
