상세검색_서비스분야,상세검색_지원형태,상세검색_신청방법,게시글_id,게시글_url,제목,요약,지역상위,지역하위,지원형태,신청기간,접수기관,전화문의,지원대상,선정기준,지원내용,신청방법,제출서류,문의처,최종수정일,스크랩시간
보건-의료,이용권,방문신청,WII000000570,https://www.gov.kr/portal/rcvfvrSvc/dtlEx/WII000000570?administOrgCd=ALL,척수장애인 재활훈련 지원,"척수장애인을 위한 심리재활, 사회 재활, 동료상담가 파견, 지역사회복귀훈련 등",중앙부처,,이용권,상시신청,한국척수장애인협회,한국척수장애인협회 (☎ 02-786-8483),○ 척수장애인,지원대상과 동일,"○ 척수장애인들에게 재활 프로그램 실시 - 종합상담실 운영, 동료상담가 파견 사업, 지역사회복귀 코디네이터 파견 사업 등 상담사업 전개 - 동료상담가 및 지역사회복귀 코디네이터 양성 등 교육사업 전개 - 지역사회복귀훈련, 가족기능 강화 등 재활지원 사업 전개 - 생활체육활동, 문화. 여가생활지원 등 문화 체육활동 지원 사업 전개 등","한국척수장애인협회에 방문하여 신청(방문주소:서울시 영등포구 의사당래돌22,6층 4호)",지원신청서,한국척수장애인협회 (☎  02-786-8483),2020-12-17,202210061351
보건-의료,이용권,방문신청,627000000121,https://www.gov.kr/portal/rcvfvrSvc/dtlEx/627000000121?administOrgCd=ALL,가사·간병 방문 지원,,대구광역시,,이용권,상시신청,주민센터,희망복지과 (☎ 053-803-6993),"○ 만65세 미만의 생계·의료·주거·교육급여 수급자, 차상위계층, 기준 중위소득 70% 이하 계층 중 아래에 해당하는 사람으로 가사·간병 서비스가 필요한 자 - 장애정도가 심한 장애인 - 6개월 이상 치료를 요하는 중증질환자 - 희귀난치성질환자 - 소년소녀가정, 조손가정, 한부모가정(법정보호세대)의 아동   * 이 경우 서비스 대상자는 자녀.손자녀가 됨 - 만 65세 미만의 의료급여수급자 중 장기입원 사례관리 퇴원자 - 기타 시·군·구청장이 예산의 범위 내에서 가사·간병 서비스가 필요하다고  인정하는 자",,"○ 서비스 내용 - 신체수발 지원 : 목욕, 대소변, 옷 입기, 세면, 식사 등 보조 - 건강 지원 : 체위변경, 간단한 재활운동 보조 등 - 가사 지원 : 청소, 식사준비, 양육보조 등 - 일상생활 지원 : 외출 동행, 말벗, 생활상담 등 ○ 서비스 가격(시간당 15,600원) : 소득수준 및 이용시간에 따라 정부지원금 차등 지원 - 월 374,400원(월 24시간) - 월 421,200원(월 27시간) - 월 624,000원(월 40시간)",○ 방문 신청 - 주민센터 : 거주지 관할 읍면동 주민센터에 방문 신청,,희망복지과 (☎  053-803-6993),2022-07-18,202210061351
보건-의료,이용권,방문신청,629000000141,https://www.gov.kr/portal/rcvfvrSvc/dtlEx/629000000141?administOrgCd=ALL,가사·간병 방문 지원,,광주광역시,,이용권,상시신청,거주지 주민센터,광주광역시 사회복지과 (☎ 062-613-3393)동구 노인장애인복지과 (☎ 062-608-2624),"○ 만 65세 미만의 생계, 의료, 주거, 교육급여 수급자, 차상위계층 중 아래에 해당하는 사람으로 가사간병 서비스가 필요한 자  - 장애정도가 심한 장애인  - 6개월 이상 치료를 필요로 하는 중증질환자 - 희귀난치성 질환자 - 소년소녀가정, 조손가정, 한 부모 가정 - 만 65세미만의 의료급여수급자 중 장기입원 사례관리 퇴원자  - 기타 위에 준하는 경우로 시·군·구청장이 예산의 범위 내에서 장애정도가 심하지 않은 장애인, 부상으로 인한 장기치료자 등 가사·간병 서비스가 필요하다고 별도로 인정한 자",,"일상생활과 사회활동이 어려운 저소득층을 위한 가사간병 서비스를 지원함으로써 취약계층의 생활 안정을 도모하고 가사간병 방문 제공인력의 사회적 일자리 창출○ 바우처를 통한 가사간병서비스 제공(세면, 식사 등 보조, 외출동행, 청소 등)- 서비스가격에서 정부지원금을 뺀 차액 부담- 정부지원금은 소득수준 및 이용시간에 따라 차등지원- 서비스제공은 최소2시간 이상을 원칙으로 함","연중, 대상자 주민등록 주소지 관할 읍면동 주민센터에 신청","O작성서류-사회보장급여(사회서비스이용권) 신청(변경)서-개인정보제공동의서 등 * 필요한 경우, 자격 확인 등에 필요한 별도 서류를 첨부해야함.",광주광역시 사회복지과 (☎  062-613-3393)동구 노인장애인복지과 (☎  062-608-2624)서구 장애인희망복지과 (☎  062-350-4493)남구 고령정책과 (☎  062-607-3482)북구 장애인복지과 (☎  062-410-6327)광산구 생활보장과 (☎  062-960-6847),2021-12-30,202210061351
보건-의료,이용권,방문신청,399000000114,https://www.gov.kr/portal/rcvfvrSvc/dtlEx/399000000114?administOrgCd=ALL,가사·간병 방문 지원,,경기도,남양주시,이용권,상시신청,주민센터,남양주시청 일자리복지과 (☎ 031-590-4311),"○ 만 65세 미만의 기준중위소득 70%이하 계층 중 아래에 해당하는 사람으로 가사·간병 서비스가 필요한 자 - 장애인(심한장애) -  6개월 이상 치료를 요하는 중증질환자 - 희귀난치성 질환자 - 소년소녀가정, 조손가족, 한부모가정(법정보호세대)의 아동 - 기타 위에 준하는 경우로 시·군·구청장이 가사·간병 서비스가 필요하다고 별도로 인정한 자(부상으로 인한 장기치료자 등)",,"○ 서비스내용 : 가사,간병 서비스 방문지원 ○ 서비스금액 - A형  (월 24시간)  ㆍ정부지원금(1인/월) : 가형 374,400원 / 나형 351,940원  ㆍ본인부담금(1인/월) : 가형 면제 / 나형 22,460원 - B형  (월 27시간)  ㆍ정부지원금(1인/월) : 가형 408,560원 / 나형395,930원  ㆍ본인부담금(1인/월) : 가형 12,640원/ 나형 25,270원 - C형 (월 40시간)  ㆍ정부지원금(1인/월) : 624,000원   ㆍ본인부담금(1인/월) : 면제 ○ 제공기간 : 12개월(A,B형은 연장가능)",○ 방문 신청 - 주민센터 : 거주지 관할 읍·면·동 주민센터 방문,,남양주시청 일자리복지과 (☎  031-590-4311),2022-03-04,202210061351
보건-의료,이용권,방문신청,420000000173,https://www.gov.kr/portal/rcvfvrSvc/dtlEx/420000000173?administOrgCd=ALL,가사·간병 방문 지원,,강원도,강릉시,이용권,상시신청,주민센터,생활보장과 (☎ 033-640-5139),○ 만 65세 미만의 생계·의료·주거·교육급여 수급자·차상위계층,,"○ 가사 간병 방문 지원사업 서비스 표준 - 신체수발 지원 : 목욕, 대소변, 옷 입기, 세면, 식사 등 보조 - 건강 지원 : 체위변경, 간단한 재활운동 보조 등 - 가사 지원 : 청소, 식사준비, 양육보조 등 - 일상생활 지원 : 외출 동행, 말벗, 생활상담 등","○ 방문 신청 - 주민센터 : 거주지 관할 읍면동 주민센터에 방문 신청 - 신청기간 및 장소 : 연중, 대상자 주민등록 주소지 관할 읍면동 주민센터에 신청 - 구비서류 : 사회보장급여(사회서비스이용권)신청(변경)서 1부",,생활보장과 (☎  033-640-5139),2022-07-18,202210061351
보건-의료,이용권,방문신청,382000000127,https://www.gov.kr/portal/rcvfvrSvc/dtlEx/382000000127?administOrgCd=ALL,가사·간병 방문 지원,,경기도,의정부시,이용권,상시신청,주민센터,복지정책과 (☎ 031-828-4158),"○ 만 65세 미만의 생계,의료,주거,교육급여 수급자, 차상위계층 중 아래에 해당하는 사람으로 가사간병 서비스가 필요한 자                         - 장애정도가 심한 장애인                              - 6개월 이상 치료를 요하는 중증질환자(보건복지부장관이 고시한 중증질환 상병 해당자로, 최근 3개월 이내 발행된 진단서 또는 소견서 첨부)                                                       - 희귀난치성 질환자(보건복지부장관이 고시한 희귀난치성 질환 상병 해당자로, 진단서 또는 소견서 첨부, 단 ""행복e음""을 통해 산정특례 등록여부 확인이 가능한 경우에는 관련 자료로 대체 가능)                   - 소년소녀가정, 조손가정, 한부모가정(법정보호세대)    * 이 경우 서비스 대상자는 자녀, 손자녀가 됨    - 만 65세미만의 의료급여수급자 중 장기입원 사례관리 퇴원자                                      - 기타 시,군,구청장이 예산의 범위 내에서 장애정도가 심하지 않은 장애인, 부상으로 인한 장기 치료자 등 가사,간병 서비스가 필요하다고 인정하는 자",,"○ 간병방문 이용권(바우처) 제공 - 서비스 내용  ㆍ신체수발 지원 : 목욕, 대소변, 옷 입기, 세면, 식사 등 보조  ㆍ건강 지원 : 체위 변경, 간단한 재활운동 보조 등  ㆍ가사 지원 : 청소, 식사준비, 양육보조 등  ㆍ일상생활 지원 : 외출 동행, 말벗, 생활상담 등  - 서비스(바우처) 지원기간  ㆍ기존대상자는 자격 결정일로부터 1년 (단, 시,군,구의 재판정 절차를 통해 1년 단위로 연장 가능)  ㆍ의료급여수급자 중 장기입원 사례관리 퇴원자는 6개월(연장불가) - 서비스 제공시간  ㆍ기존대상자 : 월 24시간 또는 월 27시간 (이용자가 희망하는 제공시간 선택)  ※ 서비스 제공시간에 따라 정부지원금과 본인부담금이 달라집니다. - 의료급여수급자 중 장기입원 사례관리 퇴원자 : 월 40시간(6개월)",○ 방문 신청 - 주민센터 : 주소지 관할 읍·면·동 주민센터 방문,"사회보장급여(사회서비스이용권) 신청(변경)서, 사회서비스 전용 국민행복카드 발급(재발급) 신청서, 사회서비스 전용 국민행복카드 발급을 위한 법정대리인 동의서, 국민행복카드 상담전화를 위한 개인정보 제공동의서, 개인정보 수집·이용 및 제3자 제공 동의서, 자격확인 등에 필요한 별도 서류 첨부",복지정책과 (☎  031-828-4158),2021-11-26,202210061351
보건-의료,이용권,방문신청,386000000116,https://www.gov.kr/portal/rcvfvrSvc/dtlEx/386000000116?administOrgCd=ALL,가사·간병 방문 지원,,경기도,부천시,이용권,상시신청,주민센터,부천시청 복지정책과 (☎ 032-625-2849),"○ 서비스 대상자 - 만 65세 미만의 기준중위소득 70% 이하 계층 중 가사, 간병 서비스가 필요한 자  - 장애정도가 심한 장애인, 소년·소녀가정, 중증질환자, 한부모가정 등 - 만 65세 미만의 의료급여수급자 중 장기입원 사례관리 퇴원자",,"○ 사업내용  - 신체적, 정신적 이유로 원활한 일상생활과 사회생활이 어려운 저소득취약계층에 대하여 월 24·27·40시간의 가사·간병 서비스를 이용할 수 있는 이용권(바우처) 지원 - 신체수발지원 : 목욕, 대소변, 옷 입기, 세면, 식사 등 보조 - 건강지원 : 체위변경, 간단한 재활운동 보조 등 - 가사지원 : 청소, 식사준비, 양육보조 등 - 일상생활지원 : 외출 동행, 말벗 생활상담 등",○ 방문 신청 - 주민센터 : 주소지 관할 읍·면·동 주민센터 방문,,부천시청 복지정책과 (☎  032-625-2849),2022-07-13,202210061351
보건-의료,이용권,방문신청,553000000124,https://www.gov.kr/portal/rcvfvrSvc/dtlEx/553000000124?administOrgCd=ALL,가사·간병 방문 지원,,경기도,화성시,이용권,상시신청,주민센터,복지사업과 (☎ 031-5189-3909),"○ 만 65세 미만의 기준중위소득 70% 이하 계층 중 아래에 해당하는 사람으로 가사・간병이 필요한 자  ※ 2022년 2월 신청자부터 적용, 기존 대상자 : 기준중위소득 50% 이하(수급자・차상위)(장애정도가 심한 장애인・6개월 이상 치료를 요하는 중증질환자・희귀난치성 질환자・의료급여 수급자 중 장기입원 사례관리 퇴원자 등)  ※ 중복수혜 불가 : 장애인활동지원서비스, 노인맞춤돌봄서비스, 보장시설입소자, 노인장기요양보험급여, 의료기관 입원중인 이용자",,"○ 만 65세 미만의 기준중위소득 70% 이하 계층 중 아래에 해당하는 사람으로 가사・간병이 필요한 자  ※ 2022년 2월 신청자부터 적용, 기존 대상자 : 기준중위소득 50% 이하(수급자・차상위)(장애정도가 심한 장애인・6개월 이상 치료를 요하는 중증질환자・희귀난치성 질환자・의료급여 수급자 중 장기입원 사례관리 퇴원자 등) ○ 신체수발 지원 : 목욕, 대소변, 옷 갈아입히기, 세면, 식사 등○ 신변활동 지원 : 체위변경, 간단한 재활운동 보조 등○ 가사지원 : 청소, 취사, 장보기, 양육보조 등○ 일상생활지원 : 외출동행, 정서지원, 업무대행 등",○ 방문 신청 - 주민센터 : 주소지 관할 읍·면·동 주민센터 방문,,복지사업과 (☎  031-5189-3909),2022-03-04,202210061351
보건-의료,이용권,방문신청,419000000127,https://www.gov.kr/portal/rcvfvrSvc/dtlEx/419000000127?administOrgCd=ALL,가사·간병 방문 지원,,강원도,원주시,이용권,상시신청,주민센터,원주시청 생활보장과 (☎ 033-737-2671),"○ 사업대상 : 만 65세 미만의 기초생활수급자 및 차상위계층 중 - 장애정도가 심한 장애인 (※장애인활동지원 서비스 우선 신청) - 중증질환자, 희귀난치성질환자, 의료급여 장기입원 사례관리 퇴원자 - 소년소녀가정, 조손가정, 한부모가정의 자녀 및 손자녀 - 예산의 범위 내에서 장애정도가 심하지 않은 장애인",,"○ 일상생활과 사회할동이 어려운 만 65세 미만의 기초생활수급자 및 차상위계층에게 가사·간병인 파견 서비스(신체수발, 청소·식사, 외출동행 등) 지원 ○ 서비스금액(1인/월)  - 정부지원금  ㆍA형(월24시간) : 가형 355,200원 / 나형 333,890원  ㆍB형(월27시간) : 가형 387,610원 / 나형 375,620원  ㆍC형(월40시간) : 592,000원 - 본인부담금  ㆍA형(월24시간) : 가형 면제 / 나형 21,310원  ㆍB형(월27시간) : 가형 11,990원 / 나형 23,980원  ㆍC형(월40시간) : 면제 ○ 제공기간 : 12개월(단, 재판정 절차를 통해 1년 단위로 연장 가능)",○ 방문 신청 - 주민센터 : 주소지 관할 읍면동 주민센터에 방문 신청,,원주시청 생활보장과 (☎  033-737-2671),2021-11-25,202210061351
보건-의료,이용권,방문신청,338000000106,https://www.gov.kr/portal/rcvfvrSvc/dtlEx/338000000106?administOrgCd=ALL,가사·간병 방문 지원,,부산광역시,수영구,이용권,상시신청,주민센터,기초생활보장과 (☎ 051-610-4338),"○  만 65세 미만의 기준중위소득 70% 이하 계층 중 아래에 해당하는 사람으로 가사ㆍ간병서비스가 필요한 자 - 장애정도가 심한 장애인 - 6개월 이상 치료를 요하는 중증질환자 - 희귀난치성 질환자 - 소년소녀가정, 조손가정, 한부모가정(법정보호세대) - 만 65세 미만의 의료급여수급자 중 장기입원 사례관리 퇴원자 - 기타 시ㆍ군ㆍ구청장이 예산의 범위 내에서 장애 정도가 심하지 않은 장애인, 부상으로 인한 장기 치료자 등 가사·간병 서비스가 필요하다고 인정하는 자 ※ 장애인활동지원 서비스 대상자는 활동지원 서비스를 우선 활용(만 65세미만의 의료급여수급자 중 장기입원 사례관리 퇴원자 제외)",,"○ 신체수발지원 : 목욕, 대소변, 옷입기, 세면, 식사 등 보조 ○ 신변활동 지원 : 체위변경, 간단한 재활운동 보조 등 ○ 가사지원 : 청소, 식사준비, 양육보조 등 ○ 일상생활 지원 : 외출 동행, 말벗, 생활상담 등","○ 방문 신청 - 주민센터 : 주소지 관할 읍면동 주민센터에 방문 신청 - 본인, 친족(배우자, 8촌 이내 혈족,4촌 이내 인척) 등이 대상자 주민등록 주소지 동 행정복지센터 방문 신청",,기초생활보장과 (☎  051-610-4338),2022-07-18,202210061351
보건-의료,이용권,방문신청,335000000102,https://www.gov.kr/portal/rcvfvrSvc/dtlEx/335000000102?administOrgCd=ALL,가사·간병 방문 지원,,부산광역시,금정구,이용권,상시신청,주민센터,금정구청 사회복지과 (☎ 051-519-4792),"○ 만 65세 미만의 기준중위소득 70% 이하 계층 중 - 정도가 심한 장애인 - 중증질환자 - 희귀난치성 질환자 - 소년소녀가정, 조손가정, 한부모가정(법정) - 의료급여수급자 중 장기입원 사레관리 퇴원자 - 기타   ※ 2022.2월부터 수급자 및 차상위  → 기준중위소득 70% 이하 계층으로 확대 적용",,"○ 신체수발 지원 : 목욕, 세면, 옷 입기, 식사 등 ○ 건강 지원 : 간단한 재활운동 보조, 체위변경 등 ○ 가사 지원 : 청소, 식사준비, 양육보조 등 ○ 일상생활 지원 : 외출 동행, 말벗, 생활상담 등",○ 방문 신청 - 동 행정복지센터 : 거주지 관할 읍면동 주민센터에 방문 신청,"공통서류 : 사회보장급여(사회서비스이용권) 신청(변경)서, 신분증추가서류 : 가사간병 대상자에 속하는 질환 및 자격 확인 등을 위한 서류(해당자에 한함)",금정구청 사회복지과 (☎  051-519-4792),2022-07-18,202210061351
보건-의료,이용권,기타,509000000125,https://www.gov.kr/portal/rcvfvrSvc/dtlEx/509000000125?administOrgCd=ALL,노인 건강증진 지원,,경상북도,영주시,이용권,상시신청,신청 불필요,영주시청 노인장애인과 (☎ 054-639-6355),○ 65세 이상 기초생활수급자 및 70세 이상 일반노인,,"○ 65세 이상 기초생활수급자 및 70세 이상 일반노인에게 월 1매/1인 분기별 노인건강증진권 지원(1매당 5,000원)",○ 개인 신청절차 없음 - 별도 신청 불필요,,영주시청 노인장애인과 (☎  054-639-6355),2021-11-29,202210061351
보건-의료,서비스,온라인신청,420000000179,https://www.gov.kr/portal/rcvfvrSvc/dtlEx/420000000179?administOrgCd=ALL,방문건강관리 지원,,강원도,강릉시,서비스,상시신청,보건소,방문건강관리실 (☎ 033-660-2304),"○ 건강관리서비스 이용이 어려운 사회, 문화, 경제적 건강취약계층 - 경제적기준 : 기초생활수급자, 차상위계층, 건강보험 하위 20% - 사회적기준 : 북한이탈주민, 지역아동센터(빈곤아동), 청소년쉼터, 소규모 영세사업자 - 문화적기준 : 다문화가족 - 연령기준 : 65세이상 독거노인, 75세이상 노인부부 가구 - 기타 : 한부모가족, 조손가족, 장애인가족, 암 및 정신질환자 가족",,"○ 서비스대상 : 65세이상 독거노인, 75세이상 노인부부, 기초생활수급자, 차상위계층, 다문화가족, 한부모가족 등 ○ 서비스내용 : 방문간호사가 가정을 방문하여 개인별 맞춤형 보건의료서비스 제공 및 복지서비스 연계 - 기초건강체크, 건강상담 - 만성질환관리 및 낙상예방 등 보건교육 - 보건소 내외 자원연계, 복지서비스 연계 - 의료용 소모품 등 지원  ○ 서비스절차 - 건강관리가 필요한 대상자 담당간호사 방문 - 건강상태 및 건강문제 확인 - 대상자 등록 - 건강상태에 따른 방문주기 분류 - 주기적인 건강관리 서비스 제공","○ 방문 신청 - 보건소 : 관할 보건소 방문 - 도움이 필요한 본인, 가족, 이웃 누구나 신청 가능 - 전화접수 또는 직접방문",,방문건강관리실 (☎  033-660-2304),2022-07-17,202210061351
보건-의료,서비스,온라인신청,450000000116,https://www.gov.kr/portal/rcvfvrSvc/dtlEx/450000000116?administOrgCd=ALL,치매 조기검진비 지원,,충청남도,공주시,서비스,상시신청,보건소,보건소 치매정신과/ 치매안심센터 (☎ 041-840-8811),○ 기준 중위소득 120% 이상,,"○ 치매조기검진비 지원 - 선별검사(1차) 결과 인지저하자 대상으로 2차(진단검사),3차(감별검사) 검사시 협약병원 연계 및 비용 지원 - 치매진단검사(2차) : 상한 15만원 이내 지원 - 치매감별검사(3차) : 상한 8만원 이내",○ 방문 신청 - 보건소 치매안심센터 : 거주지 관할 보건소 치매안심센터 방문,,보건소 치매정신과/ 치매안심센터 (☎  041-840-8811),2021-11-22,202210061351
보건-의료,서비스,온라인신청,629000000129,https://www.gov.kr/portal/rcvfvrSvc/dtlEx/629000000129?administOrgCd=ALL,청각장애인 인공달팽이관 수술 지원,,광주광역시,,서비스,상시신청,주민센터                                                                                                                                                                                                                                                                        시·군·구청,동구청 노인장애인복지과 (☎ 062-608-2612)서구청 장애인희망복지과 (☎ 062-360-7093),○ 광주광역시 거주하는 중위소득(건강보험기준) 120% 이하 가구 청각장애인,,○ 기준중위소득(건강보험기준) 120% 이하 가구 청각장애인에게 인공달팽이관 수술비(500만원) 또는 재활치료비(300만원) 지원,○ 방문 신청  - 관할 행정복지센터 또는 구청 방문,"인공달팽이관 수술 및 재활지원 신청서(필수)수술시)수술가능확인서(필수)재활시) 재활치료 계획서(필수)개인정보수집,이용동의서(필수)",동구청 노인장애인복지과 (☎  062-608-2612)서구청 장애인희망복지과 (☎  062-360-7093)남구청 장애인복지과 (☎  062-651-3422)북구청 장애인복지과 (☎  062-410-6354)광산구청 노인장애인과 (☎  062-960-3840),2021-12-30,202210061351
보건-의료,서비스,온라인신청,542000000111,https://www.gov.kr/portal/rcvfvrSvc/dtlEx/542000000111?administOrgCd=ALL,자체 예방접종 지원,,경상남도,고성군,서비스,상시신청,읍보건지소,보건소 (☎ 055-670-4089)읍보건지소 (☎ 055-670-4872),○ B형간염 예방접종 - B형간염 노출 고위험군(성인) ○ 인플루엔자 예방접종 - 60세 이상 64세 이하의 성인 - 13세 이상 18세 이하의 청소년 - [국민기초생활 보장법] 제 2조제1호에 따른 수급권자 - [장애인복지법]에 따른 장애의 정도가 심한 장애인 - [사회복지사업법] 제2조제4호에 따른 사회복지시설의 입소자 - [국가유공자 등 예우 및 지원에 관한 법률]에 따른 국가유공자 - 그 밖에 고성군수가 예방접종이 필요하다고 인정하는 사람 ○ 로타바이러스 예방접종 - 부 또는 모와 자녀(기 출산한 자녀가 있는 경우)가 6개월 이전부터 계속 고성군에 주민등록을 두고 있는 첫째아 이상 자녀(생후 8개월 미만),,○ 성인B형간염 예방접종(유료)○ 인플루엔자 무료 예방접종○ 로타바이러스 무료 예방접종,○ 방문 신청 - 읍보건지소 방문,로타바이러스 예방접종- 주민등록등본 지참,보건소 (☎  055-670-4089)읍보건지소 (☎  055-670-4872),2022-07-14,202210061351
보건-의료,서비스,온라인신청,307000000102,https://www.gov.kr/portal/rcvfvrSvc/dtlEx/307000000102?administOrgCd=ALL,미혼모자 의료비 지원,,서울특별시,성북구,서비스,상시신청,보건소,건강관리과 (☎ 02-2241-6004),○ 만5세 이하 자녀를 둔 관내 미혼모 및 그 자녀,,○ 미혼모와 만 5세 이하 자녀의 의료비 지원 - 한 가정당 50만원 한도,○ 방문 신청 - 보건소 : 거주지 관할 보건소 방문,,건강관리과 (☎  02-2241-6004),2021-11-18,202210061351
